reviewId,userName,userImage,content,score,thumbsUpCount,reviewCreatedVersion,at,replyContent,repliedAt,sortOrder,appId
gp:AOqpTOEdQiUJG2GTwzlX1tck-s4SJdy3okgm9iY3nFou3Cf6fAjopFx08elhRuA3rRQfLYREm_eG9NcfefCSi0k,NskPHEONIK GAMING,https://play-lh.googleusercontent.com/a-/AOh14GgDikcW2JcUoX0m5isTBSXrn-XgvfXfNJEWYvMiOQ,Saya kasih bintang 3 karena saya gk bisa tarik uang lewat dana padahal akun dana saya premium mohon segera atasi masalahnya🐼🐼,3,2,19.5.42,2021-05-24 11:20:33,,,most_relevant,com.ss.android.ugc.trill
gp:AOqpTOGwOj_AIJnoqWlXtNH8AtpY8MhRZJWxxDZdB6XMR3TF2BaS07oP1jYzplT584NmFcRDTVqFDF5UTQSiup8,niken amanda,https://play-lh.googleusercontent.com/a/AATXAJzfgOC_mPW1xX5WC3YTnk9xclqlVozFX-qvmRCZ=mo,Padahal jaringan lancar tapi knp saat saya buka tiktok ga bisa ada muncul tulisan gini tidak ada koneksi jaringan padahal kuota masih banyak jadi tolong benerin🙏😊,3,1,19.2.41,2021-05-15 08:09:43,,,most_relevant,com.ss.android.ugc.trill
gp:AOqpTOHicfw2o3vgY5EK7He5cEgBt8uU1_KoI4_U81M59lKSUHGu9u8NRm6U0JqwNKhIm18MkSEw-MqfFxtMPjA,Akbar Rudin,https://play-lh.googleusercontent.com/a/AATXAJyRZI93E1Eb1h-0kSvbgEGjZrc1ZLfzwyOnXMvq=mo,Aplikasinya jelek banget !!!!!!!!!!!!!!!!!!!!!!!!!!!!!!!!!!!!!!!!!!!!!!!!!!!!!!!!!!!!!!!!!!!!!!!!!!!!!!!!!!!!!!!!!!!!!!!!!!!!!!!!!!!!!!!!!!!!!!!!!!!!!!!!!!!!!!!!!!!!!!!!!!!!!!!!!!!!!!!!!!!!!!!!!!!!!!!!!!tapi boong hayyuk,3,25,19.5.42,2021-05-20 12:49:51,,,most_relevant,com.ss.android.ugc.trill
gp:AOqpTOF5tVbqg4RoigOKWgiCeLO7iUWs521s8rw4MOEuTGnOFVZYfw-375fmlu7hqCorcG3Ur1uVactaMAaWS6w,T.K.L Gaming,https://play-lh.googleusercontent.com/a-/AOh14GipYjbnukRzHpRZCL0rUG7t4kBZqHE-7c4_h_uGzg,Oke siap bos Pcan iya sih emang ada apa sih itu orang yang suka cowok dari motornya baru tau aja apa mau ke sini aja sih gue sindir iya sih ya kalo punya twitter iya dong ya sama dia ya buat kalian semua kesepian tapi masih di dunia ini adalah pribadi suyy nnti mlm lu Dijamblang Ni lu mao kmna aja deh biar adil kok malah ngantuk nih gue sama gue tapi gue mau nanya aja deh ya kalo punya pacar aja kadang cewek lain kali kalo di twitter itu kan gue juga ya allah semoga besok masuk sekolah ya kalo m,3,0,18.7.41,2021-05-29 13:07:18,,,most_relevant,com.ss.android.ugc.trill
gp:AOqpTOEamrmY0T5_Xhlj0TUHvEFeCSeB9_iKI76G8E52dcu4WBcGVFC6mN-U_jLrRqTqGukIK6skiIe4mP6x0ho,Mohammad Sarman,https://play-lh.googleusercontent.com/a-/AOh14GjDc6CT6pX-dGGQXVGvJHQYW9n_BKsWIFc8Zel-Uw,"Masa cuma balas orang yang komen yang ngatain bego kita di banned, klo orang pada komen = ngntd gak diban bingung saya",3,1,19.5.5,2021-05-20 13:26:30,,,most_relevant,com.ss.android.ugc.trill
gp:AOqpTOGiLJgFlEFcxB-xDaK25BZtYSfGht0S4QUmRVJ0vCto5-AMGFz31A4h6OqfviVf0GYSyZ3rrmlQYVQkUdw,Abdul azyz,https://play-lh.googleusercontent.com/a/AATXAJxZ8oPrrrdntYDaNhNckLerXmK4teTgj8AZBELw=mo,"Jelek banget apk nya followers gua ga naik""!!!!!!!!!!!!!!!!!!!!!!!!!!!!!!!!!!!!!!!!!!!!!!!!!!!!!!!!!!!!!!!!!!!!!!!!!!!!!!!!!!!!!!!!!!!!!!!!!!!!!!!!!!!!!!!!!!!!!!!!!!!!!!!!!!!!!!!!!!!!!!!!!!!!!!!!!!!!!!!!!!!!!!!!!!!!!",3,8,19.2.41,2021-05-22 18:43:46,,,most_relevant,com.ss.android.ugc.trill
gp:AOqpTOH0TtPTaj6VvXQ0zob1BtYmRbyamWGCnDCjNnd6RmgBsWwOuhFX7wFXrKFu36DGN6oVYrjabG6GB1GQ-pw,Al.sanwal Syafla,https://play-lh.googleusercontent.com/a-/AOh14GjlV7zEvyULrO-W9ugA39ACs-HuVy2v9Y3wB2Ex,"Bintang 3,krn aku ank ke 3. Klo mslh app bagus nya gk usah di tanya,komen sndr aja..",3,1,19.3.4,2021-05-23 17:49:27,,,most_relevant,com.ss.android.ugc.trill
gp:AOqpTOEixmggl6MFa2202dMMDTugvp-X-nl43vZVZ4ct98A6reNjNikz1f9UuUDf69uOHGvnCXX8acCelELDtVU,Caca Mohamad,https://play-lh.googleusercontent.com/a/AATXAJy17aGuASo1JL6pzyrltVXIEmbrIEoDK6gNeXWu=mo,Aku kasih 3 bintang soalnya like dan flowers ku dikit kalo dah banyak aku kasih 5 bintang 🙂,3,0,19.5.43,2021-05-25 16:16:28,,,most_relevant,com.ss.android.ugc.trill
gp:AOqpTOEwgVoUN56uNVWHO7z2syFtitdhDFDBm7_ziohEsazUs00745oMnrE7qVAG6YhYUvxVNSckFWQ1WxrwM-g,Syifa Adzkia,https://play-lh.googleusercontent.com/a/AATXAJwIXQhIcyYuu-wPwGwrDBLLB9wZDZnhfLd8vlx4=mo,Buat pemilik tiktok kenapa akun saya di blokir saya sudah mencoba keluar dari tiktok dan saya masuk lagi dengan akun yg berbeda tetapi kok belum bisa ya 😡 knp,3,2,19.3.3,2021-05-08 04:18:48,,,most_relevant,com.ss.android.ugc.trill
gp:AOqpTOH0CUdyi90Ouk5GZ2J-4RHg0Jrs4Heb0g3_P9xqhsgQjMV3OhTT8cdXzibzsnZh3LgY_Ubcd229mHB-f4k,Ahmad Fahrozi,https://play-lh.googleusercontent.com/a-/AOh14GjueDEbdFnS7NiMFTaZSlsOqH2rUB99Gz9PZRhA,Kenapa klo saya undang teman teman saya gk bisa masukin kodenya tulisanya eror tidak lolos kontrol penipuan tolong gimana ni yaa,3,1,19.2.41,2021-05-05 06:09:59,,,most_relevant,com.ss.android.ugc.trill
gp:AOqpTOHX8SalXmdMpCzNVyqDIwiTnO8_VBR40HQuOvaLbC0rAthFhuTaRJwLj897UMtbnGhKp9uGh4pLwRJoV-s,Nico Artheta88,https://play-lh.googleusercontent.com/a-/AOh14Ggy5RnmRbso9sFFqcDV7XVTElOqHuT4wpjvVwcBeg,Yg aktif aja yg dpt bonus yg sudah kita ajak download awal aja dpt bonus seterus nya nggak aturan sama dpt jga nggak perlu aktif,3,1,19.5.5,2021-05-24 20:47:17,,,most_relevant,com.ss.android.ugc.trill
gp:AOqpTOHKRDIP_HroBNDPffOYu6BGJFDWA9_7MObALGXpgL3njKqaxX0U-ACMuVHagm9M_AbjLTYkezSppmtSrCg,Yasin Jepara,https://play-lh.googleusercontent.com/a/AATXAJyB6vQhERtNi4WIEgZ5yzlGbQHHDnX40prB6sGf=mo,Aplikasi ini sangat jelek banget !!!!!!!!!!!!!!!!!!!!!!!!!!!!!!!!!!!! Tapi bohong Yayuk aplikasi bagus kalian,3,4,19.3.4,2021-05-08 13:28:23,,,most_relevant,com.ss.android.ugc.trill
gp:AOqpTOEUg2bOJZBTsDxDsEVxlGOGW0usABUSQ2B0c6g4g-c43QV_oTk0YcjPhII8tMgL7pKHZ_8rtqu7LYt7I5c,raisa,https://play-lh.googleusercontent.com/a-/AOh14Ghr0I-gqk4DneHCcbncEocimqjoH6aMOiq4PReWDg,Aku suka banget sama Tik Tok ini ja di nya aku bintang lima mamah ku juga suka sama Tik Tok ini dan sampai sini dulunya jagan lupa download aplikasi TiK Tok ya bye -bye😘👋,3,1,19.3.4,2021-05-17 08:46:16,,,most_relevant,com.ss.android.ugc.trill
gp:AOqpTOGkRqH76yKZ-YMs-kZ2TRuLo11H8B8kgoeGnd6ZIlqhAgd6ZC6zJRQa0c11A_9JmpuJSw1qLha7CNaaGCk,Mufid Azzaim,https://play-lh.googleusercontent.com/a-/AOh14GhDtjEMSk9r2x37Fqm0ux_hCDe9k4bRlT2hP--WtQ,"Tolong ya Tiktok, penarikannya jangan hanya ke akun yang premium, saya udh kekumpul banyak koinnya tapi tidak bisa ditarik karena akun dana saya belum premium",3,1,19.2.41,2021-05-07 04:21:03,,,most_relevant,com.ss.android.ugc.trill
gp:AOqpTOGpT7BWb3R6Meb6FvpL6MUkwV4_JXY62cYTFqiwZ1FRgeMc-hYOJDVOT47-hg_IcrDixKePCSwmWP1FqCI,Margareta Lira,https://play-lh.googleusercontent.com/a/AATXAJwxgNOcMySf1WxtV87hE-QS9olwTaw1U0bkzNUZ=mo,Tolong bantuan nya dong tiktok ndk bisa terhubung dengan dana jadi saya ndk bisa narik uang nya,3,1,19.5.43,2021-05-24 16:03:05,,,most_relevant,com.ss.android.ugc.trill
gp:AOqpTOH-CgyQ4ltWQw2h-bFpe2D_xbNbTe0SS5B34PC4fNRQ9IWnrWv5Wpq6VI2mOYilpgmi97T-_CPityauxGo,Ica Nisa,https://play-lh.googleusercontent.com/a/AATXAJxiWOZHHFKY4wWSc4hlMMO3ywqepH-ykkVLznBs=mo,Saya ingin mendaftar saya sudah menulis nama nomor tapi tidak bisa makannya saya kasih tiga bintang dan saya sudah pencet berikut tapi tidak bisa,3,1,19.5.4,2021-05-16 09:09:10,,,most_relevant,com.ss.android.ugc.trill
gp:AOqpTOFHvv0ahRB6r622miL1IkpVHCy8PaoWRwO1lfOZLn7mw2uDnsaTlSHqghBxQ2HR-LDK-phoq91ZIOjomKA,celine angel,https://play-lh.googleusercontent.com/a-/AOh14GjrQMc53lYMPYxNgC9e6rRfdDlYgAei3doSFpbo,Kenapa saya undang teman susah amat isi code nya selalu Error' tidak lolos contro penipuan gmn sich niat gx bagi hadia nya kl tidak niat jangan buat evant nya donk begitu banyak saya suruh teman mama saya main tp gx bisa masukin code nya,3,3,19.3.4,2021-05-12 06:00:50,,,most_relevant,com.ss.android.ugc.trill
gp:AOqpTOF2dU_KDCbK88lEe5-o0o67Csw2JZqbau13clpRDaa7tZBdCCjxZTjNijYeZgbAaBt18NsDM2ez5FNYVyI,Ahmad Rifani,https://play-lh.googleusercontent.com/a/AATXAJwbg6V2bY5AvUPSwslaY18RrKfw58v0V7SpHBvS=mo,"Tiktok ini agak kurang ajar juga, komenan ku udah berapa kali di blok, sampai akunku ada yg di blok selamanya, sedangkan mereka yg bikin konten, itu video langsung loh hampir telanjang setengah badan, bisa di posting, kalau gak ada konten kayak gitu komenan kami juga gak akan sembarangan",3,1,18.9.4,2021-05-11 11:26:53,,,most_relevant,com.ss.android.ugc.trill
gp:AOqpTOFDEcdjguRq1KSK0_sDiHdBcgHrvnga0TubEQucuq4KAdyMqXrifhWhfjd_S9pi3AswDZuBuAG5W1XtCPU,Muhamad Rizkidarmawan,https://play-lh.googleusercontent.com/a/AATXAJztG0I15qqI6MjHswM2hXFuuR15nEcDZjIdNMJZ=mo,Hallo tiktok kenapa aku pas buat konten kok views nya kok dikit yak cuman 1 orang doang dan aku udah buat hastag fyp betteroneserro dan lain lain tolong dijawab yak tiktok,3,3,19.3.3,2021-05-03 02:01:39,,,most_relevant,com.ss.android.ugc.trill
gp:AOqpTOEBk0_3dq0NTHjD0TJFx_dXLjqRJ7fCwuXWEFpxp0EDyKDpyM0L-Jl5IKtY4fGBlyAy87W8B0zHmifWr2U,Kenzi Maulana,https://play-lh.googleusercontent.com/a/AATXAJwMvZlrzOnKiP31jFvtFtcihGpwEAhk96Pu1lfz=mo,Misi tonton Vidio kok gak ada ya? Masukan kode undangan juga error' terus. Gmna ya,3,1,19.5.42,2021-05-22 22:03:12,,,most_relevant,com.ss.android.ugc.trill
gp:AOqpTOHAtVDFxrs9D5gtuOEhX38gLOO5W-s_0iJVj0aqVEZDtn5mRrUpjQGwehYdc4LpOVF52i-dK6bfUZ1XIN4,Nizar Herdiansyah,https://play-lh.googleusercontent.com/a/AATXAJwHp3VX86yJywWoBqkhE759jdH3rfa4bVHdzV8p=mo,Saya kasi bintang 3dulu ntar kalo datang event yang lebih gde dan lebih mudah saya tambahin😊,3,0,19.5.43,2021-05-26 21:20:21,,,most_relevant,com.ss.android.ugc.trill
gp:AOqpTOGe0LmQVOzJuHpdM40qBGLlLR7a3HqckGkfB6q5MiplBQB-TkmhsN1HvTsQpDxMvrAgdfCqaSfcKsvsse4,Jan Rahdiansyah,https://play-lh.googleusercontent.com/a/AATXAJwRObvQgo0WBEckHtB2wD0EqTj8iCABv20CUOaA=mo,Kenapa setiap ngundang orang skrg ga bisa.. tidak lolos kontrol penipuan terus.. elu ngontrol pake apa cuk?,3,0,19.5.42,2021-05-27 15:03:19,,,most_relevant,com.ss.android.ugc.trill
gp:AOqpTOGoktXBwqWo6ThX5lqdHXB5lPwk0hu0VWaoGO-MDFJxwOKFdr7mEMe0rtPCyKPRxw0dAfxWOhB-UVC2dJg,Lela Eko,https://play-lh.googleusercontent.com/a/AATXAJzINCcB4-zZ160VKqpzNyNYv_5HwQLgGmBUOo-M=mo,mana aqu pengguna baru tp gak ada buat masukan kode nya dah....???tlong dong....,3,1,19.5.42,2021-05-21 04:34:48,,,most_relevant,com.ss.android.ugc.trill
gp:AOqpTOGIUoYmdAi8R3RqTVAZ8Qxg9_vuZxYky_wTV7DHqy1JoQycMAN026VOvfVT70xTsSYF1BLCS9lvSso7YX8,Mir_ chartz,https://play-lh.googleusercontent.com/a-/AOh14GjJ3a1Xn1zK0YymORtx_a3aZLc4mAxkdX2TpONzd2U,Aplikasi nya sih bagus tetapi kenapa akun saya @mirthaf0619 di ban selamanya? Saya tidak melakukan apa-apa tolong pihak tik tok segera memperbaiki ini,3,1,19.3.3,2021-05-07 11:46:03,,,most_relevant,com.ss.android.ugc.trill
gp:AOqpTOEawbBQu0XcuQOInWtaM-2vmcXdjGbEtqMGn-6ACbpMthHlIjlvOJytL_g8QElduL_pxqLLYaAT6_AblAE,Naufal Hendriawan,https://play-lh.googleusercontent.com/a-/AOh14GjOC6xhJ0ndrWq-2nCn4meUdNpRtfBhWPjGXK8e,"Tolong dong untuk penggantian nama pengguna kalo bisa dipeecepat jangan 30 hari, kasian kita yg typo gak bisa ganti nama lagi sampe 30 hari :'(",3,1,19.3.4,2021-05-11 04:14:24,,,most_relevant,com.ss.android.ugc.trill
gp:AOqpTOE_WApdMrvc_YSDLwBGGNi29mURDHe47a_QtNPTaAtbp8eroNbyZ-QdCBaXscBhYPLI7eiwuxEDUqzZv6c,rahmat chairi,https://play-lh.googleusercontent.com/a-/AOh14GhYE0lqdTyfbe3WX0PM0F3sT3q5nW-AWC8PdiTTDw,Mohon untuk verivikasi wajah di apk tiktok diadakan! Agar mempermudah login jika lupa email dan no hp Dan bnyak juga no hp yg hilang dan email tidak aktif,3,1,19.2.41,2021-05-05 11:39:49,,,most_relevant,com.ss.android.ugc.trill
gp:AOqpTOFQcTcYMfrBoYM9C1GkIeFzH7Sy5S5Vb9syNdx5rq998uLot5eg_P2q81Dl2CMP7hkIpNMFon6DpmrSFiw,Chya Bontt,https://play-lh.googleusercontent.com/a-/AOh14GgK05EejcJv1SvYIflGd2UQCFuIoFhosCm5RFhm,3 aja yaa.. video ku kadang fyp kadang engga. Kadang rame kadang sepi.. tolong lah kondisikan kasihan kami udh berusaha tpi gk fyp 🥺,3,1,19.3.4,2021-05-24 21:09:33,,,most_relevant,com.ss.android.ugc.trill
gp:AOqpTOGu0AyuYjC4XG5bcySE3cRzeobQHjgJUyr95TARSd2BUNsPfyOGseAMoO7kR4cX6qY-AhjgHRyinio1Ims,Galih Sutardji,https://play-lh.googleusercontent.com/a/AATXAJwRzJMOO-Ktt5raBkqgyqdGwlckwTshS-sI_b30=mo,"Masa Kode undangan nya tidak bisa di masukan eror, tidak lolos kontrol penipuan. Ini gimana ya persoalannya?",3,3,19.3.4,2021-05-17 10:22:25,,,most_relevant,com.ss.android.ugc.trill
gp:AOqpTOGtLbbxpExil2R-ShehLnc9Y0qRN35jkjSiUh5K14lfNfdbNi33dZKG40V7l9-3eH4FO-KTaX5lKnXt4tU,Rv Story,https://play-lh.googleusercontent.com/a-/AOh14Gjkgoqw1KMv-9_mTSU3WAeCaV-ZuVNqyqVKmEZ0OnM,Banyak anak di bawah umur yang menonton adegan² panas di tiktok Sebaiknya ditindaklanjuti bagi orang tua para anak yang tidak mengawasi anak mereka,3,3,19.3.3,2021-05-01 15:54:52,,,most_relevant,com.ss.android.ugc.trill
gp:AOqpTOECaZad8_vmcdxy-_aySut88eiFZiAigigBGCQvbTEnUOpFl6KiyuR9NGXjHIqAYpkVL40okjoJ8opGbc4,Kenang Kenung,https://play-lh.googleusercontent.com/a/AATXAJxlDOFpVpt8dzUa5juIzYTTC_nUmGIlvOB5xHVx=mo,"Bagus banget aplks nya,cuma mohon di perbaiki yahh karena setiap menit selalu macet dan keluar sendiri😥",3,1,19.3.4,2021-05-17 10:38:24,,,most_relevant,com.ss.android.ugc.trill
gp:AOqpTOG3r1EwOvouyp26ffyArgFiZBH1mXgjl0WUAm7TYVZmnN6m593_ggczsLlptZfQvaNLSIrUOeBxb87w-5k,Tistaadd 35,https://play-lh.googleusercontent.com/a-/AOh14GjJ-UQBSSxA5f7rROj7l3AveoPYJDJNE31bdwUkhQ,"Assalaamu'alaikum warohmatullahi wabarokatuh... Pihak tiktok, tolong beri fitur yg lengkap dong. Kalau mau nge-share video kesana knp harus sampai 3 menit doang? Please dong di terusin biar bisa sampai 5 menit an videonya 🙃dan saya mau nanya, font yg di pakai di tiktok itu namanya apa ya? Saya pengen download soalnya😌🙏🏻sekian, terimakasih...✨ Wassalaamu'alaikum warahmatullahi wabarokatuh🙏🏻🙃",3,19,19.3.4,2021-05-11 05:52:53,,,most_relevant,com.ss.android.ugc.trill
gp:AOqpTOEGlxCNEYBvzLCxcqRU57Y8nmLvG8oRvI9TTbIZBsN5AuiYTk36xoUiRatq_1F58i7eYhkw6QgovKAsyGo,DUO GAMERS,https://play-lh.googleusercontent.com/a-/AOh14GgbDvCZDKlwC4FtEe5bnvca9rq4D4WAsfIOoPtvkQ,Untuk depolever tolong ya kalo ada vidio sex tolobg di hapus karna tidak baik untuk anka kecil di bawah umur,3,1,19.2.41,2021-05-10 09:04:58,,,most_relevant,com.ss.android.ugc.trill
gp:AOqpTOH9K7oumIgZMXMxWoYuq81B3V2yXMJ9xRBFWxXkvaiZisrTGYOzIUA0ndErDuSpTnmRuCtEdFZf_u7_5ik,Moh. Ikbal,https://play-lh.googleusercontent.com/a-/AOh14Gh0PkpDpdg9lRaqCIsVsrhiZA7uhkq6HrmpreMuOw,"kali ini untuk tiktok saya kasih bintang 3 saja, karena watermark yang dalam vidio cukup menggangu dan terlihat ribet atau jelek, mohon di perbaiki watermark nya jadi lebih bagus dan simpel saja. yang kedua watermark di akhir vidio yang sangat menggangu dan memperpanjang durasi. yang ketiga mode gelap pada android belum tersedia, semoga kedepan nya semua android bisa mendapatkan mode gelap",3,4,19.5.5,2021-05-27 07:39:39,,,most_relevant,com.ss.android.ugc.trill
gp:AOqpTOF6LTqPKoeI2XsuJqCLMf5qoPUvdnw8B5KQ6uJF8yshS2nJ1Fb8Luf243rrFVZfYdkrWlnVRXo7oxa13Dw,Isman Nudin,https://play-lh.googleusercontent.com/a/AATXAJweILQtJ_tjZicDvlYIqYLlcO6Rd1wu3OMgqoUp=mo,PENARIKAN NYA GAGAL TERUS UDAH SAYA TUNGGU SELAMA 3-4 HARI MASIH BEGITU JADI SAYA KASIH BINTANG 3 MOHON BANTUAN NYA YA MIN BIAR PERNARIKAN SAYA GAK GAGAL TERUS!!,3,1,19.5.42,2021-05-22 19:33:23,,,most_relevant,com.ss.android.ugc.trill
gp:AOqpTOGTAVIJd2HTok-AoWPZe6f8oTqGNHE54oXDjNBqd0Q9_TXQ1-kYiIepcHjZCScCWCr6aU3kHiaeIklV4-U,HILMAN JANWAR,https://play-lh.googleusercontent.com/a/AATXAJzaQmRDlmqt8BZvUXuEqftl6BDB4jUJIUtteUDe=mo,assalamu'alaikum kepada pihak tik tok kenapa di akun saya ga ada event yg 360 yg dilain mah ada Mohon perbaiki snack video aja ngga gini,3,1,19.5.42,2021-05-22 15:24:28,,,most_relevant,com.ss.android.ugc.trill
gp:AOqpTOHArld2iPnJyfzz9tyAS4A_q3JypWa_t8-dMbRKVqlA_pwuFE7xaJpAATGkqj-Y-DLQh8nFkT03lkSxYT0,Sariya 22,https://play-lh.googleusercontent.com/a/AATXAJwI076IbMrxboJnyul3bJwLgtjOvinSP0KpzMc=mo,"Kenapa saya tidak bisa memasukan kode rujukan muncul keterangan error, tidak lolos kontrol penipuan, saya kasih bintang 3 dulu deh",3,2,19.3.4,2021-05-11 20:39:26,,,most_relevant,com.ss.android.ugc.trill
gp:AOqpTOGH33potqx-s_BX9qvRpAyo2BPM4a3w04P-hG0_F87RH1jt-2CbVuohMlFFUCYqU36I15FTTKqtWS9FC4o,Bogak Montong,https://play-lh.googleusercontent.com/a/AATXAJwuyF92mefkvBEWqNELhc9Djg4vurz2_4daFq8=mo,Tolong untuk akun fake alias reuploader di takedown biar jadi pelajaran tidak jiplak karya orang lain Kasian yang punya karya,3,1,19.5.4,2021-05-21 06:45:13,,,most_relevant,com.ss.android.ugc.trill
gp:AOqpTOHfA59Er4KXnpOr435GOTCyzE07BOSrZMh1ajf9TkWczfz6mHvxmnH79Djq3ygIh_NKV6AeM9OHnAuz3Vg,Romi Irawan,https://play-lh.googleusercontent.com/a/AATXAJyb8DFuk699ybuf0y8tusfMWdlR2CY0xO5RGnDn=mo,Ini gmna sih sya masukin kode ke orang2 masa ngga bisa .masa kode penipuan aja bacaanya.tolong di prbaiki .klo dh ngga baru sya kasih bntang 5 mksih,3,2,19.5.4,2021-05-19 20:14:50,,,most_relevant,com.ss.android.ugc.trill
gp:AOqpTOFzUJ6PYAXSX4oaBLzNzIaiyrb2AUoFpzw6RfhXxkeG_KwIjo_yhWA1Y2yW1wsxarTtEvGkWKcbXoApCJY,Alan Selfadil,https://play-lh.googleusercontent.com/a-/AOh14GgrakC8kv9aw8ymBhg7d6REhaXLWSQjea1NInW6,"Ini masih bagus videonya, cuma mau tuker poin ke ovo sudah tidak bisa lagi, jadi sudah untuk melakukan tukar poin dengan saldo. Jadi tolong bener",3,5,19.5.4,2021-05-16 19:10:58,,,most_relevant,com.ss.android.ugc.trill
gp:AOqpTOHm-kkDatzrHMc8_52xrUx6_DY5L8phY4RtJgu8LGJ_LqyPaVHFmhG5IOj_u0Cftsyfqg9bWe5MaYXmIlk,Yana Yana,https://play-lh.googleusercontent.com/a/AATXAJyjpiA-lIjuoY2mJMuF1B-38A0j3KfYJyYOhM8D=mo,"Semoga applikasinya kedepannya lebih baik lagi yah. Terkadang banyak fitur yang gak bisa aku pake, apa karena hp andro!!! Tolong dong, jangan pilih kasih!!☺️",3,1,19.1.3,2021-05-25 12:59:20,,,most_relevant,com.ss.android.ugc.trill
gp:AOqpTOHqSVBmXy5uX3dHF9r3nAneQE4mnfwgbV7TLMMDc4TY4Ul62hbOUYKwhrHqJlJ3VhL8xPnyZ3M9jWJrNPI,Zhas Prs_08,https://play-lh.googleusercontent.com/a-/AOh14GhWUY-4MchdwZhqwoNA8cutPG1KP-UcT7FrdZjKGA,Gw kasih bintang 3 dulu nih Gw mau narik saldo ke dana kok nggak bisa dan ada baca tidak bisa menautkan akun dana Dan jg tulisan ny kek gini Gunakan dana premium,3,1,19.3.4,2021-05-11 12:42:06,,,most_relevant,com.ss.android.ugc.trill
gp:AOqpTOEqxsvKjvlFSUik9i6u9C9mO-eP2knwRth0Qj5oAP1g8tbrOnU6m76ELfCjEYLVXBFhzZAPBDUnzzLgCqs,25 Nabila Salma Faizulloh,https://play-lh.googleusercontent.com/a-/AOh14GiSFnp2EWOgeEZ64EXzH-uyDPkgBvVgy8laZo5AfA,"mkstmu apa y tiktok, ku sdh update y knp g bisa sematin komen, hp mamah me bisa knp hp me ga bisa njem. Pilih kasi nii ☹️☹️",3,0,19.5.43,2021-05-29 13:55:10,,,most_relevant,com.ss.android.ugc.trill
gp:AOqpTOGAQNgE8cNEUfcxIN-dNEGFMMvUzUsuAzPOablbkPcBzQFgaVSGmR9xQm2Q5EBfHJ6Zs_RNdFlxpG5d2fY,joshuaa berthy,https://play-lh.googleusercontent.com/a-/AOh14GhO-GND-dsTw6vHM__ANP9OWEXpc7aYRABlXzdBIQ,TIKTOK mohon keamanan nya di perketat lagi.. Akun saya tiba tiba ke tuker Ama akun orang lain dan gak bisa masuk.. tolong di perketat lagi keamanan nya kasian orang yang banyak Followers nya tiba tiba akun nya hilang..,3,1,19.3.4,2021-05-14 03:31:36,,,most_relevant,com.ss.android.ugc.trill
gp:AOqpTOHU3gJeJi4DWKUpAl2uZRWnLvJGylwVCWx0qYxOETAYWpKoQxfCg9FxppfbN-qS0jVpwIWUQWQmQtjd35k,Yeoja Jeslyn Aldebaran,https://play-lh.googleusercontent.com/a-/AOh14Gj4QXk8dCn4-auPbirW4Rj-HQxeLEFiBivzZa_XWg,Apk nya bagus tapi knp followers aku naik turun maaf aku cuman kasi bintang cuman 3 klo udh di perbaiki nanti aku kasih bintang 5 mohon di perbaiki kak,3,1,19.5.3,2021-05-15 00:49:54,,,most_relevant,com.ss.android.ugc.trill
gp:AOqpTOEE9JalqhiP14e-fTYkawsFLU9TXzfmLeXHZr6_c2NaEDWmJLyFx68Hfmrp_LJCfSASCXHFTmxCZ4KslOg,Tyabeckz 2211,https://play-lh.googleusercontent.com/a-/AOh14GiFj0lNMPJFrbuzDqAIlegCq74cTxinaTXV3Kdo,Hasil editan gak sesuai stelah dipost. Ngeselin bgt! Susah2 diedit pas di post jdi beda..tulisan kemana2 ada ilang pulak. Coba di perbaiki,3,2,19.3.4,2021-05-12 11:29:16,,,most_relevant,com.ss.android.ugc.trill
gp:AOqpTOGFMwAyglzXr0QNSwdCoKLPDO9_TtmjT59tFy5GA-I91RGukl_DewQ3yqS1QUGnlkUXMa8wgB0aJuoxFGs,Hajilu Mamahi,https://play-lh.googleusercontent.com/a/AATXAJynqNNT-3B929sNLmTuwbVy6fUJ8agc5LLgObww=mo,Kenapa event nya selalu eror ya.😭 Tadi event yg dapet 1jt nya muncul eh sekrang ngilang..lagi perbaikan/gimana?,3,1,19.2.41,2021-05-15 14:05:35,,,most_relevant,com.ss.android.ugc.trill
gp:AOqpTOGuQRScZmWh7H8bJqA1iV37UQcr-d7FGH87GWNL9o3Y4PMiX5VdL-HMIgoqc-W28M-rkJtR54LLpwjeSyA,aisha ramadhani,https://play-lh.googleusercontent.com/a/AATXAJwL7fiUBeB2PjDx2NwT6tEliWFgnquFq3-Qnimy=mo,Saya ksih bintang 3 dulu klo ini bagus baru saya ksih bonus 2 saya belum pernah main tiktok soalnya ini haram ya 👍,3,1,19.2.41,2021-05-07 14:04:15,,,most_relevant,com.ss.android.ugc.trill
gp:AOqpTOGIRC1lhLvrjX8VHShgPXiZ7lpq66ESU1I1KCpxcg0VFLrXPP4r9l8iIwboq3tdXQxc-TCOIwkQYRZqBnY,Sakata Gintoki,https://play-lh.googleusercontent.com/a-/AOh14GhujHrxz6YWJTaWav_YLCmhkyGKZR0hu4-d5b7V,Yahh kalo bisa sih pas ngambil saldo nya di perbaiki sih karna harus pake dana premium kalo bisa pake dana biasa aja biar semua makin seneng dan semangat download tiktok.itu saja saran ku semoga cepat di perbaiki saat pengambilan saldo dana yang harus pake dana premium ribet juga,3,0,18.9.4,2021-05-26 13:43:41,,,most_relevant,com.ss.android.ugc.trill
gp:AOqpTOHgct87peeD3ObgpIME_BB_patALdmfVGyrsQxPtsbgkDr4IxTWoHTh6Oj3qW5OQZW7O7RPYtxrItWNQaA,Maia mayhardi,https://play-lh.googleusercontent.com/a-/AOh14Gj1TZ-dCaxLAtlLTA-4Z8SSkz7v-m4431beNgK89Q,Maaf sy kurangi🌟🌟nya soalnya slalu disuruh update pdhl bru diapdate knp begitu...????,3,1,19.2.41,2021-05-08 01:09:52,,,most_relevant,com.ss.android.ugc.trill
gp:AOqpTOEDchYrLfKj0yQVf3mcwuUk1pCFK-EdV7FgKJqYTSSDpgQhJoykBAaebdlneXvYa6ltD-uXTMrVweiSC4g,Ros Mawaty,https://play-lh.googleusercontent.com/a/AATXAJz60PeK8uMP9wbQc8sf_vsIJ8fv41l2Rq0cNLmF=mo,Saya merasa terbantu dengan adanya aplikadi tik tok apalagi di masa pandemi seperti sekarang.,3,1,19.3.4,2021-05-24 10:26:55,,,most_relevant,com.ss.android.ugc.trill
gp:AOqpTOHRxz3iR1F7t8f0qWoOhIOeDaJ6dcpRfwzkriFn-BqmWlOZUur9auh-m1NQqskq1OzZLGrJ9upsi0-umTU,Nur Ma,https://play-lh.googleusercontent.com/a-/AOh14GjyhuFU9ZpJJ9z0RbmzBNxpsOfmND6lBOEYcx_P,70.000 coin : 10 = 7 k. Pas Liat hasilnya. KOK tidak nyampek ya????.,3,1,19.3.4,2021-05-12 09:58:08,,,most_relevant,com.ss.android.ugc.trill
gp:AOqpTOEadbphw7OC71cJWIvYk2iJKCRsVnfGmxXtC1_eJGPykqfN5e0R47oYmqwIVPqbVUExlSrvonMgLMQMU6o,Alisa Afifah,https://play-lh.googleusercontent.com/a/AATXAJxten8w7oea0hzQuAOnX3XlWdI15yAIlkMMghJ5=mo,Kenapa tidak bisa masukan kode yah padahal pengguna baru malahan tulisan nya eror kontrol penipuan kenapa yah min,3,1,19.5.42,2021-05-22 16:07:49,,,most_relevant,com.ss.android.ugc.trill
gp:AOqpTOGvUIghdPLbONErqb0xHY08MZHUzSjpVlqu2RaN6tUFA0vReE6aG2s-kkQToVXySXP2BRqrFEvUkwCD078,Dira Chelsia,https://play-lh.googleusercontent.com/a/AATXAJwFZyClbX0C1zdpfp2gJyd-oi-cyLHhkt1is_a6=mo,"Apk ini jelek banget !!!!!!!!!!!!!!!!!!!!!!!!!!!! tapi bohongg ,buruan di download🥰",3,1,19.2.41,2021-05-13 14:16:05,,,most_relevant,com.ss.android.ugc.trill
gp:AOqpTOFdAoGljxZr3qlkrfsH3ubqE1rC9sJLf6W4Oyc789YQcyTmjp6nTS8KWKyzqQFtvQ-f9ZuL4NvpGkDPOXY,Hom Satun,https://play-lh.googleusercontent.com/a/AATXAJxfYUz52P0CjZNt_YUC6GxmBDQo2MPvep7D1P40=mo,Kenapa kok bisa lemot padahal aku kan seneng banget di aplikasi tiktok padahal kan jaringan nya gak lemot,3,1,19.5.42,2021-05-20 20:20:06,,,most_relevant,com.ss.android.ugc.trill
gp:AOqpTOHR3G9iZ8fIE_Hc21RMBuHGY3kBl4C9r_Cimklufk9Y1MiTYKz29i5S_TOd20SwEEbO_P73TAMiJ3uXk7Y,Riska Anggraeni,https://play-lh.googleusercontent.com/a-/AOh14Gi9_qtoWI9QNDcuTwFUOL-JmOsSQhoUR49hEERX,"Jiji bgt liat orang komen !!!!!!!!!!!! Sampek seratoss,Ga guna bangeet buset dah.",3,2,19.3.4,2021-05-11 22:01:05,,,most_relevant,com.ss.android.ugc.trill
gp:AOqpTOE5AArZw0x0CZahl0WOLqOT0u_jl8DgPap4q_UmsqQQ0kJ4CrgDk_EOdvviT12cOQXZzNQCkQZJ7xzPLVY,Dhani Achmad,https://play-lh.googleusercontent.com/a-/AOh14Gh4vWBCKRjH9MuaIRbNuySXsttHUgJh-Fj1IXxB,Tolong bantuannya min Kenapa setiap saya masukin kode Terjadi Kesalahan Mulu?,3,0,19.5.43,2021-05-28 12:33:49,,,most_relevant,com.ss.android.ugc.trill
gp:AOqpTOHKfR01xxkNkns69iC2nlNbnLLv0S_UCxpdi1hceffSjaYy8TBG38Gm22oeoUlUfqtJwRUPmDU-eFS3Bvs,Raffael Benaya,https://play-lh.googleusercontent.com/a-/AOh14GgMeSD_ykYQ5A4ibHAkWFB9pr6-G7Yr3CeEGGEM,Saya Menarik Uang Ke Bank 300 Rb Sampai Sekarang Belum Masuk Sedikit Pun Mohon solusinya Secepatnya!,3,1,19.2.41,2021-05-08 12:56:06,,,most_relevant,com.ss.android.ugc.trill
gp:AOqpTOGASpfNtidgYZWKEsPCPd-ZMaKxfme9PzNJOlPZuthxz556oY7SN2UgGSGhl0VKjLbvaeLywPNDV0nGQ88,Agung setiawan,https://play-lh.googleusercontent.com/a/AATXAJwUkH_H-v2Paq9SYoP4RdrM4mMT-RWTChFWVfeL=mo,"Bagus,tapi sering gagal memasukkan kode referal tertulis indikasi penipuan,emang menipu apa",3,1,19.5.42,2021-05-24 13:24:45,,,most_relevant,com.ss.android.ugc.trill
gp:AOqpTOEUv8D9O6JeeK9LdWDv1wYX4yF34EKECkWDJnQOH3t_rBBVKzsIB3XyLDIRp9zEdwtfZnbcGrzYC39XuPk,GAMER GAME,https://play-lh.googleusercontent.com/a-/AOh14GiczoKd-yyMbbb1VMfCJorwy9AGKhubHedGzD8v,"Apk ini bagus tapi banyak bug yang harus diperbaiki yaitu 1.bar memasukkan kode undangan tidak muncul padaal pengguna baru dan sebelumnya belum pernha donlod/memasukan kode teman 2.(error tidak lolos kontrol penipun)padahal pengguna baru dan bug ini sekarang saya alami,tolong di perbaiki",3,21,19.3.4,2021-05-10 17:32:00,,,most_relevant,com.ss.android.ugc.trill
gp:AOqpTOGl1B5qy4Nw0WAMZhG8ejNdnTbze0sdLZxn0rQfuGC92GA00yvWFosNfyEa_nyQYis4ywKtmCy8YYoun5Y,Haji Suyono,https://play-lh.googleusercontent.com/a/AATXAJwHNlbRRX5hegc2lB6dAlNeq4MdNj9WQvOH8EM6=mo,Saya kasih bintang 3 soalnya saya sudah menyelesaikan misi mengundang 5 orang tapi bonus 300.000 nya tidak masuk!!,3,1,19.3.4,2021-05-15 00:44:36,,,most_relevant,com.ss.android.ugc.trill
gp:AOqpTOHYY1737LnldpbmB4eks5qVHNGzOHRXzgAxXqYUtjQK3-PMvQiN_eKK21FhiqOUeqgcudJO9RAZLVVyHnk,Jordan nathanael siregar,https://play-lh.googleusercontent.com/a-/AOh14Gjt9qKWOypWsJda-r1Kp2f0PU6fpndbIvZ5k22B,"misi...kok pas saya ngedaftar gak bisa,,ada tulisan ""maaf, anda tidak memenuhi persyaratan tiktok..terima kasih sudah tertariik !"" jadi gak bisa daftarr",3,1,19.3.4,2021-05-14 05:50:16,,,most_relevant,com.ss.android.ugc.trill
