reviewId,userName,userImage,content,score,thumbsUpCount,reviewCreatedVersion,at,replyContent,repliedAt,sortOrder,appId
gp:AOqpTOFmo_38MYP7cSiMgp___6OlxtxKUczyo6EIv_Za5giFW4a-AyH4LkFulOQH4Sus4EyQBLhBSWIIQ7bY6Q,mine bear,https://play-lh.googleusercontent.com/a-/AOh14Gi9cj2Z-8LudcZZ7U46PkbLV0TaOAulLZzOymBn,Kenapa ya setiap saya main one tv lah pertama nya pasti ada itu itu jorok deh tapi saya masih suka sama aplikasi ini buat saya terhibur ya tapi saya kasih 3 bintang dulu karena setiap saya nonton please jangan di jorokin dong video nya kok malah muncul anu apa ya gk usah lah jorok yang penting takut sebut nya aja 🤭,3,4,605030,2021-03-12 12:18:43,,,most_relevant,omegle.tv
gp:AOqpTOEq-OmAscfZSD0bdJMD__sH7hgpBwWA-tTWSwOb7ltFy8kgonjiuIqIiJPgTexH7t3XqOwhZg22P4cixw,ALFIY Haaniyah WULANDARI,https://play-lh.googleusercontent.com/a-/AOh14Giag7gdSEP8Jx_eoI5FVaneg_qx2h3jrpSWyvvGMw,"Uh sorry sebelumnya, sebagian orang yang menggunakan apk ini ada bapak²nya dan terkadang ada yang memperlihatkan yang tidak harus dilihat orang lain .Jadi, pintar lah menggunakan apk, for bochil tidak disarankan dan harus didampingi orang tua . Thanks",3,177,605030,2021-03-12 21:34:17,,,most_relevant,omegle.tv
gp:AOqpTOFYy0bvPutCMo__wWAqyWQh0XjoP9cbq493Rr9vSMns5YCYSYWvbTN1837oo47Xeo4nim3W12D8b7_SHw,Arik2_ 608,https://play-lh.googleusercontent.com/a-/AOh14GhbZVOlWIuM1btsMONtE7VRp_lnSGOD9MOOHjwS,"Alasan mereka ban akun., gw rasa krna trllu bnyak yg gk senonoh jadi pihak develover random aja ban nya,. Dan berimbas pada kita² yg tidak tau apa². Terimakasih OME TV",3,0,,2021-03-16 22:27:16,,,most_relevant,omegle.tv
gp:AOqpTOFB91udOXRJR8T9DOixwyZ39t09gww6qy-AXrlccSOnM9kzJ_iwLDZPcH1PIPKPGQlv_Mya21ibpFy6-g,mrzaqiy 07,https://play-lh.googleusercontent.com/a/AATXAJx2YicTr55c5YwtNwl3ehpH0fOQacyrOKJ3nMWI=mo,"ADMIN YANG TERHORMAT, Tolong anda memberikan hukuman Baned hanya berlaku 24 Jam saja, karena sering sekali dari pihak anda memblokir akun kami tanpa alasan yang jelas. Hal ini sangat jelas merugikan kami semua khusunya para konten kreator video OmeTv. Dimohon Admin dapat berlaku dengan bijak dan dapat memberi solusi dalam permasalahan ini 🙏. Terimakasih.",3,0,,2020-12-06 01:37:18,,,most_relevant,omegle.tv
gp:AOqpTOGdAhGXlGOXA9-w_vDsk6lx0IzieM0U_9HCq4Ap8weu6f9gXcHNwnmXT5JUxkDn0NYEMbyGb8WFWlfNUw,Sofia Nur cholis,https://play-lh.googleusercontent.com/a/AATXAJxycH58L6l_jiSSdo-R4r0GwnmVz23jfA1DCMAD=mo,emmmmmmmmmmmmmmmmmmmmmmmmmmmmmmmmmmmmmmmmmmmmmmmmmmmmmmmmmmmmmmmmmmmmmmmmmmmmmmmmmmmmmmmmmmmmmmmmmmmmmmmmmmmmmmmmmmmmmmmmmmmmmmmmmmmmmmmmmmmmmmmmmmmmmmmmmmmmmmmmmmmmmmmmmmmmmmmmmmmmmmmmmmmmmmmmmmmmmmmmmmmmmmmmmmmmmmmmmmmmmmmmmmmmmmmmmmmmmmmmmmmmmmmmmmmmmmmmmmmmmmmmmmmmmmmmmmmmmmmmmmmmmmmmmmmmmmmmmmmmmmmmmmmmmmmmmm lumayan baik,3,0,,2021-04-17 23:04:59,,,most_relevant,omegle.tv
gp:AOqpTOGjuNuZ4h8ZCBva87e5VYDGGBrSenKs295-xYnN6JWcjGUUzTdqa7zCinpDYtKWTwjWW9T38JuAmFMwaA,Haris Pujianto,https://play-lh.googleusercontent.com/a/AATXAJwGOEPMOBngKTmLqKZJVaguvXK-j_ZQSLnd6e5S=mo,Kenapa saya di banned tidak terbuktikan saya melakukan hal yang melanggar kecuali sudah terbukti...emang saya suka aplikasi ini Bisa berkomunikasi sama sodara saya di luar sana...mohon di cbut,3,0,,2021-03-06 21:30:26,,,most_relevant,omegle.tv
gp:AOqpTOFeuQgSyF0GCpuw1qyWLFEAKg-EjTnMi_YOg32y1BPYdwfsqPOk2Azzf6TX90Psr2m41GcPFU7zI19uOw,Meylani official,https://play-lh.googleusercontent.com/a-/AOh14Gjr2VMU5Mu5oL1eKQgFXEYcd5JB9WAw0sW2KY8piQ,"Aplikasi ini bagus, tapi saya kecewa tolong dong jangan sendat-sendat kan jadi gak bagus bukan nya menghina yah maaf. Padahal hape saya IPhone upss maaf bukannya untuk bermaksud pamer tapi memang bener hape saya baik aja kok ga ada kendala apapun saat saya membuka aplikasi yang lain di hape saya. Tolong yah developer nya mohon di perbaiki agar banyak di minati banyak orang.",3,0,,2021-01-16 20:01:05,,,most_relevant,omegle.tv
gp:AOqpTOGyTsMy3gTjFprPRy3K5X7rv6zpN4OPAklzIzrfrZadfpRFxrgGg1PatLdihLDL1SaeiLUwPGtZrYl9rg,wachid purwadi,https://play-lh.googleusercontent.com/a-/AOh14GjTGve00DKABOoHCNB75vjzlTfFnEDIxk8JPtNK,hei anda...iya tau kalau ada aturan jangan hadap tv atau media lain...tapi ini gak sengaja pas mode kamera belakang...jadi tolonglah dilonggarin dikit aturan bannednya...oke,3,0,,2021-03-01 16:56:41,,,most_relevant,omegle.tv
gp:AOqpTOGjooHQWdRO55dF5R5Utt5URkVqD96Ji4f5dbTsQF4WirhwhNQZOgSdWFbvzaiM_xtDG3308uGfO4MW4w,Kaslan Clp,https://play-lh.googleusercontent.com/a/AATXAJwpGYm2Y6OOBknIVCr-1QxwQ6uz0sVNqeeL1yhJ=mo,...emmmmmm gimana ya aplikasinya sih nggak terlalu jekek juga nggak terlalu bagus hmmmmm...... ya.... Lumayan lah ok cukup sekiyan terimakasih yang sudah baca.,3,0,,2021-03-04 10:18:18,,,most_relevant,omegle.tv
gp:AOqpTOGyI7pCqvdHl02oAQHlt_SxTJ5ljpuDiYy3RK3f7O6T9G3YDz_fUjZMrBkwCuAgIDWLDaB7Hb3vlBcW9w,Sanjung DrS*PROV*T,https://play-lh.googleusercontent.com/a/AATXAJyN443S3pccloI0FJ_ZRJFHXMHa8ESSrDAq5ntP=mo,"TolongLah buat pihak ome tv,jangan asal banned aja aku GK melakukan pelanggaran sama sekali,tapi ko malah kena banned,jadinya aku hapus apk donk selama beberapa minggu,Truss download lagi",3,0,,2021-04-06 18:54:36,,,most_relevant,omegle.tv
gp:AOqpTOGhfS5-VVzEEiYlIwMa6wC9dEit7_JtYmaOv4_3IfYApVH5kADIKFqNRJJCdd4pCJ_KBo7Rkfxad1Ec_g,itsme riyl,https://play-lh.googleusercontent.com/a/AATXAJzN41EFnN2dmBEXmhbDfUc6V8-gYxzcB5NQWEAd=mo,"Tolong yang orang Indonesia kalo ketemu sesama saling sapa ""Assalaamualaikum kek atau Hallo kek"" ini ketemu orang udah ngelanturin kata"" kasar,kadang ada yang lagi berbuat aneh tapi lagi siaran. Indonesia mau jadi apa kalo orang2 nya seperti itu? Emang dari kecil di ajarin nya seperti itu ya? Sekali lagi mau ingetin kita ini kan main aplikasi ini buat cari teman bukan cari musuh :) jadi kalo masih punya adab tolong di pakai adab nya :) terutama kepada orang yang baru di kenal :)",3,1403,605030,2021-02-07 19:29:25,,,most_relevant,omegle.tv
gp:AOqpTOGQ83jeeQnQwXRc7AxaMKyZdHVWaaU23SrXUWN1eCah5ZrkLXTRiv7kO-47WAla6FU--dZLetad_Mj59g,Azella Ratu Paristha,https://play-lh.googleusercontent.com/a-/AOh14Gg18DOOPcQ09Mc0xINM0HECgJcsUMXa0l6R-z-crQ,Assalamualaikum. Namaku Azella. Aplikasi ini sebenernya bagus untuk org2 yg mau memperlancar bahasa Inggris seperti saya. Saya menggunakan aplikasi ini utk keperluan tersebut. Dengan aplikasi ini saya lebih berani berbicara dgn org asing walaupun bahasa Inggris saya masih sangat berantakan. Saya ada saran kalo bisa aplikasi ini bisa juga mereport org2 yg menggunakan aplikasi ini untuk hal2 yg negatif.,3,1781,605030,2021-01-27 07:29:46,,,most_relevant,omegle.tv
gp:AOqpTOFXpZKwKOHJsQD5SANbzYSj9EwHSeGDKa2cnnHUhHW816UWCzwkla9pKhCiLhRKUOJYcZIHVjM7Ma5d6g,Diki Pangestu Pais,https://play-lh.googleusercontent.com/a-/AOh14GhP0giaAQZotfYwkbwo8rC1GeoZhjCqK_I2jNpQhA,"Negara yg dipilih itu maksudnya negara kita atau negara tujuan? Soalnya ada pilihan ""semua negara"". Tapo kalo emang negara tujuan, kenapa munculnya hampir selalu Indo dan Indo terus, padahal udah diganti berkali2. Tolongla ditambah fitur negara tujuannya biar bisa nyari strangers dari negara tertentu",3,268,605030,2021-01-10 11:16:00,,,most_relevant,omegle.tv
gp:AOqpTOEs5osHJcb68xKyzQegUOH_R7oZQTubMBnrogkqFDzrn28zGnm03MSRbGD2dPlsyN1BPySacVKw52SBxA,Christian Poltak Alexandro Sirait,https://play-lh.googleusercontent.com/a-/AOh14GgpOv9vG7InOxkpBdpz93YfjrFygip_md9QDvqY,"Aplikasinya top,tapi terlalu banyak aturan yang kurang masuk akal, contohnya ketika saya mengarahkan ke arah tv ,tiba tiba dibanned selama 2 Minggu,saya rasa tak merugikan orang yg saya vc . Seharusnya pihak ome TV cukup saja membanned yang melakukan penghinaan atau yang berbau porno atau hal yang merugikan orang lain. Terimakasih",3,1304,605030,2021-01-08 10:41:56,,,most_relevant,omegle.tv
gp:AOqpTOHiexnOvhvD_xlgag9x1hte8OA6uM4jD53_JQqTeR_aqeCh6QpnsLfXkVnVr4ILkl9LA6ywmGHyiLcjsg,Mariam Park,https://play-lh.googleusercontent.com/a-/AOh14GjDHBVMdbAkkq_jmYRLcVZXj5LmRqg6T8B8T-mpRQ,"Sebenarnya ini aplikasi bagus ya, kita bisa berkenalan dari berbagai negara dengan lebih simple. Tapi kenapa isinya kebanyakan orang-orang bertelanjang dan pornografi. Tolong di perbaiki... Orang-orang seperti itu tolong di blokir dari aplikasi ini, kalau perlu di banned🙄",3,403,605030,2021-02-03 09:58:58,,,most_relevant,omegle.tv
gp:AOqpTOGFN1G_kSIgeUSVtIHIMLEAb28fh2bOPN7QethacgeCVb5RKPNIcIpNgkPd-14JQltYD41wQeQsFjYfnA,Muhammad Yusuf,https://play-lh.googleusercontent.com/a/AATXAJwXKn4NTvJ02qn8C--qwDQrViguakz8YX5CPAdj=mo,"untuk masalah report nya saya kurang suka,masa iya saya cuma makan doang,trus di report prilaku kasar atau cabul? Why? trus durasi report nya lama juga,tolong ini di pertimbangkan.",3,0,,2021-01-30 12:28:39,,,most_relevant,omegle.tv
gp:AOqpTOEDo82iB-nWAJARq9GKptvju-cXQbJZWNum46QuAn9-HisaIS3muovEgndMf81Zzq9mtzHSVSJZlDyh6g,Mamy Paroe,https://play-lh.googleusercontent.com/a-/AOh14GhmPnNyVfnudXWX7s28mpc4Ak3PT21IoK_VB9Liqw,Awalnya sih baik baik aja tapi kok setelah beberapa Minggu akun saya di Baned. Padahal tidak ada pelanggaran apapun .,3,3,605030,2021-03-08 23:50:04,,,most_relevant,omegle.tv
gp:AOqpTOHTzRGFcNWmg_845xKuznB7jaLsWme95LkF7wvLj5CtTO89W4tbu5sfx7OfGttnowgRI_UnhotgYoz2fQ,sobat geming,https://play-lh.googleusercontent.com/a-/AOh14Ggrr_Q3v1zsnES3t1PYp_dlbTpHkJLSN-Dbuku9GA,Di aplikasi ini Bagus tapi pas gua liat agak jorok !!!!!!!!!!!!!!!!!!!!!!!!!!!!!!!!!!!!!!!!!!!!!!!!!!!!!!!!!!!!!!!!!!!!!!!!!!!!!!!!!!!!!!!!!!!!!!!!!!!!!!!!!!!!,3,1,,2021-02-01 23:11:18,,,most_relevant,omegle.tv
gp:AOqpTOFE6XvWTs37NDilo9HzpbbTAsXo5gCyOdr9xME2z3K9U_j6JCGTpES3bl3b5DybAYzcR-LThlbzOLZoXA,Muhammad Ihsan,https://play-lh.googleusercontent.com/a-/AOh14GhrTRXqcEsH0KTBPJwu5uHWcqweN78pteMjJ8_sxg,"Tolong dong pihak ome tv jangan main banned orang sembarangan, baru aja di banned udah dua bulan coba main lg baru 2 hari udah di banned lg.",3,0,,2021-04-29 17:16:13,,,most_relevant,omegle.tv
gp:AOqpTOEYu_RrJUJ6sZH9Ne05DOQU4waPkBuA4Whoj55voBQo1-Aix5HDe0h1WI9Y8AUnE1YWlYCtVExEFBA6IA,Rehan bang bewan sama rendi r,https://play-lh.googleusercontent.com/a/AATXAJzbL037UihFldRgT40ods95x_9hGNCCBPCEYBaU=mo,Kalo ada orang tua aja deh biar aman q wu tapi kok bisa ya buat kamu menangisi ada aja orang lain w iya dong yuan iya nih mau di ganggu banget deh kalo weyyrweeewww uji tweet tapi kok bisa ya kalo tau aja atau apa ya di radio kesayangan anda inginkan saat kita mau di ajak kompromi mau beli tiket pesawat pribadi kita mau gue juga bisa kali aja emang ada yang edit tapi gue juga ya allah makasih banyak orang lain hanya bisa di atur jadwal kuliah di mana ya kalo punya uang jajan mau di kasih ke mana,3,0,,2021-01-28 21:45:30,,,most_relevant,omegle.tv
gp:AOqpTOH6golCAYomLv9U5fHeKHs3Yv08_UyVtjRw6AohP75UtMDi3vs01C2iVssZvqkXBShL-Y_Ejfa3WRiEyg,Meldy Berlianni,https://play-lh.googleusercontent.com/a-/AOh14GgjdzC0Ns0Ds5ZnZxGun_VwALubo40fGZv2UcEf,"Apk ini berguna bagi saya untuk mengasah kemampuan bahasa dan saling share pendapat dengan orang yg di luar negeri maupun dalam negeri, nakun sayangnya banyak pihak yg mengunakannya dengan tidak baik dan pihak anda kurang bisa memilah mana yg benar-benar tidak senonoh ataupun tidak, banyak pihak dirugikan dan memang itu juga kembali pada diri sendiri sang pengguna, jadi mohon pihak anda untuk mejibgkatkan sedikit apk dalam hal banned. Terima kasih",3,0,,2020-12-07 15:02:03,,,most_relevant,omegle.tv
gp:AOqpTOGi09f5pKv2wG0tL9ogj-osdb-7VG3H1CqFd5gHV2KAyrHaHtz6uniCzZSiGh8X8_DO-9enAgP-Vb64LA,Zzinc Gray,https://play-lh.googleusercontent.com/a-/AOh14Gh50wd8tR-bTnFiZMEPJSCQFZNFYh8nL70MUh6AJg,Kaga jelas cuman arahin kamera belakang ke jempol kaki malah di ban apk gak jelas ban nya lama banget lagi tolong di perbaiki ya ;-(,3,0,,2021-05-21 13:18:08,,,most_relevant,omegle.tv
gp:AOqpTOHJd-IZdmJq38zba6D-inQABD3cN8TyM8tEHM7KYsgWjHCmw3aBy5FtSIO7ILE15yP49mVqJfg25xGRjQ,joko priyono,https://play-lh.googleusercontent.com/a/AATXAJyjiqmJj1qcLN_5GAzylssp5H21sWV2vPuispwU=mo,apk nya sih bagus :) tapi... ada beberapa orang yang menampakan aurat ny saya tidak suka itu :v,3,0,,2021-05-20 09:43:27,,,most_relevant,omegle.tv
gp:AOqpTOGij5iVoPxo1tOR3ooZ00fz8qegvwMGi47oAKGPHwlb9C8OR_3ZHd7dl35Vzi8Jvra029IT56krdjnH9Q,Edy Setiawan,https://play-lh.googleusercontent.com/a/AATXAJza-lBKeWKoDkCeXeBTzcNv7pSgleMUuHKE7GTE=mo,"Sebenarnya aplikasi ini bgs tapi waktu saya pertama kali bermain, saya melihat ada beberapa orang yang kurang baik dan menunjukkan yang aneh aneh jadi saya mohon jika ada orang yang kurang baik tlg diblok ya..",3,0,,2021-01-19 13:08:33,,,most_relevant,omegle.tv
gp:AOqpTOE9m0EANZKU4gKVxsmAHerisLdl_Df78TVQwLuDzHOfEcLUlTYIPfBExRC9hQebYz70He_4xwtDFaOKzw,Itz_ Ryda Editz,https://play-lh.googleusercontent.com/a/AATXAJxEUvC-Sg-S67y42kzU37p8rWUfyoKE3m_URXpu=mo,Hai mohon untuk developer ome tv tolong tambahkan negara palestina 🇵🇸 tolong sekali nanti kalau udah di uptade sama di tambahin negara palestina aku kasih 2 bintang lagi aku tunggu 1 minggu kalau gak di update aku kasih bintang 1 Plis update!!!,3,269,605030,2021-02-12 09:58:24,,,most_relevant,omegle.tv
gp:AOqpTOHy48iywJHEuqqBwaodCpl5ieO2al7jous4r47TlGGk8Mp6Nav6GV2szuL7BHguytapcARVro2Ng3yLTg,Arema Malang,https://play-lh.googleusercontent.com/a/AATXAJxT3yO2WS-bOFVb1yUnZ39pFw4CEnlhF8mhecif=mo,Bacalah peraturan dari omtv baru komen.pergunakan lah ni apk tu hal yg baik aja . kawan Allah maha tau Lo.....,3,0,605030,2021-04-14 18:54:33,,,most_relevant,omegle.tv
gp:AOqpTOHRBvtX3flDN0W9-7k4HBqnc7CA_YxwRmoxGkyB4XNxwWC7-NcXKPCDeMcTwfjzKlYlL4o0GYonAgWZYw,Aris Sutanto,https://play-lh.googleusercontent.com/a/AATXAJzaX5PHm9xUCrqXoOYPPX7Af_Wvx_E8z2G101vE=mo,Kasih 3 aja banned nya mahal Sebenarnya yg banned itu bukan pihak ome tv tapi dari orang orang nya juga yang iseng banned. Kebanyakan yg banned itu cewek. Makanya kepada pengguna klo gak mau di banned jgn banned orNg dong.,3,0,,2020-12-20 21:49:11,,,most_relevant,omegle.tv
gp:AOqpTOGeeVCERP7jYbOr2nzzQZXJIgeQE7D_h8NsRgEcywNjlsJ_V74p_9wMM3BZHLlRpOszbcvmHmU3-G2YlA,Adi Kuatno,https://play-lh.googleusercontent.com/a/AATXAJx7BHciqaA1Of9bVlofz7YFoRRQm_Qj6xEjW7pW=mo,ksh 3 bintang dlu... admin bagaimana caranya daftar register .intruksinya pakai nmr hp dengan kode negara sudah tp tetap saja gagal...solusi lain untuk register selain dengan account facebook bagaimana?,3,21,605030,2021-01-16 23:23:39,,,most_relevant,omegle.tv
gp:AOqpTOH289xrQttY0siw4KiD5L4p8K-UInpKy56qA2sb9iHQNa3KCJCkCVz0dwd3YA_rFkj2ofsd_dg0KWcKBQ,Ahmad Rizki,https://play-lh.googleusercontent.com/a/AATXAJxTn2NW67mDGpwJCMbp-GiLEjtWxJVDF8LNp1uC=mo,Iya sih saya suka aplikasi ini tapi kenapa saya bisa di banned saya kan gak ada salah kenapa yh makannya saya kasih bintang 3 aja,3,0,,2021-03-05 13:51:42,,,most_relevant,omegle.tv
gp:AOqpTOEowLP0qL-rMcxpWV-b58-AhwTxE_ZfjGHKQbB_2QkiifuAdYrNEl0rh1KNY_xB_BZpSY-UeFhZBMvJFQ,Sang Gocang,https://play-lh.googleusercontent.com/a-/AOh14GgK6VGOfxpZ8CZAvqrzIRU3B0--T6oAWUm_sPvF,"Bagus banget aplikasi ini beneraan, tapi sayang, baru 1 x make langsung kena banned padahal cmn di arahin ke layar hp sebentar dan gak ada yg negatif. Mana lama lagi bannednya males wkwk",3,0,,2021-02-01 19:50:15,,,most_relevant,omegle.tv
gp:AOqpTOETQ3s5cLELt9v-_mnjEaNp5AcAodWr_Sg8Fnc9wolqefJixQGi7wMq2EoBr0tkpHvNmgasTXHuKDjs6A,eva aja,https://play-lh.googleusercontent.com/a/AATXAJzjPBHTzRqd0ZLKxMvpZcwP6x7yS7tyWyg3HI4B=mo,"Apl nya seru banget,bisa ketemu sama orang lain,saya kasih bintang3 aja.",3,1,,2021-05-01 17:55:38,,,most_relevant,omegle.tv
gp:AOqpTOHHuh3Zr7KNnhECHQkE7KzZaxnS9TPN-873JnGJ5l1nEZwv9kWmMrog-4CsVBIK-ccyve9ZII7_If6Crg,wildan arif,https://play-lh.googleusercontent.com/a/AATXAJw2khChLN7U11ha-mtXhUIS9xE9hIICmj-t0f9j=mo,"Kurang adanya ketegasan terhadap penyalahgunaan, banyak orang rasis, pelecehan dll sungguh sedih",3,0,605030,2021-03-09 16:50:07,,,most_relevant,omegle.tv
gp:AOqpTOGOBkYiX2U3h_eqPl6Ro0pH8i0IRnX3MqfMo8Tj4GIR8AgWjejqQEuMmdRWF9Nk3zKe4yf-PODGjTBByw,Agus Purnomo,https://play-lh.googleusercontent.com/a/AATXAJxQBsQuz8AObiRV2Iy6MSueh4-xyNsJ_hGv_-uV=mo,"Mungkin bisa diperbarui lagi Ome nya,soalnya pas lagi main tau"" macet"" gitu trus gangguan padahal sinyal nya bagus tapi ada tulisan gitu makanya aq kasi bintang 3 aja",3,0,,2020-12-20 14:02:34,,,most_relevant,omegle.tv
gp:AOqpTOGgLeOuFdLYlQG0ajz73xo2Swsx-i0wwun99mH1NEl093DvzwLdEt78CZPRqeueYvIIcBL_sBqsy9h05A,Primadona Dona,https://play-lh.googleusercontent.com/a/AATXAJw-ngsTphz4WUp3gdTfpCZ7ClEx39h_1OFSdIIR=mo,"Apk ini kitaa udh ngomong sopan"" tapi malah di report ,nunggu nya supaya bisa kembali 2 mingguang lama amat",3,0,,2021-05-22 21:01:09,,,most_relevant,omegle.tv
gp:AOqpTOE6DQKe5YkQUJ7edD2zMtIemGlOj3yCqkVrwdPI8KIShrHYNdSpY4Fv_nKqhwNdE7xLXY0vyC5iowI5Kg,Kevin Aulia Muhammad,https://play-lh.googleusercontent.com/a-/AOh14GgMfEKdtFyUMI47d3sqFEzljbYQy7qvcQ1YI9BxPw,"Bingung ga ketemu org luar, ketemu nya indo terus gmn gua mau bertukar pikiran, harus pake vpn mulu tadi nya gua ga percaya indo di pisahin server nya haduuh",3,0,,2021-03-20 06:23:40,,,most_relevant,omegle.tv
gp:AOqpTOE-eTwhQ_e9M1-bopgjNHnwW_6gXqTR1kwW-yCUSPMwmO-f_pIq4TAB5LxA-727IbYeBhl4KSY1coMEJA,Hayida Dar,https://play-lh.googleusercontent.com/a/AATXAJxb0LTNWA9o1l_Hc5oYxQDmMOSWW1bCnAkb6otS=mo,"Nyesel mainan ome tv banyak banget yang cabul. Ada yang lagi on**i, ada yang ngajakin c**t. Parah pokoknya. Kok bisa ga dibanned. Ga bisa direport juga. Perlu banget diperbaiki fix!",3,206,605030,2021-02-18 16:36:05,,,most_relevant,omegle.tv
gp:AOqpTOFomJh-9OwGKnlsunc5QJ0Oz4OtAH7pxtMKOsNEz3P_KoTTQ8JpDcr90oLaIy6yEip34T2H6iM_8EHrow,ojhy sick,https://play-lh.googleusercontent.com/a/AATXAJynTVBP5f2Fd7Z0sFGflYri0rbn7XxpmsPio4v9=mo,"Tambahkan login menggunakan EMAIL, jangan fb sama fk aja, tolong!!!!!",3,0,605020,2021-03-12 02:35:04,,,most_relevant,omegle.tv
gp:AOqpTOFrICs8BGPe10TIlw_Ak4PjL-S_c7cmlabQQ7h35ni3wgYNeNXkOjw5RnQ1hde3Tyv5ERo94452Itdx3w,BIHIS channel,https://play-lh.googleusercontent.com/a-/AOh14GhBqmG8zytCDydV9fQETHSIy82ea1jFGWBo8Yg9,Woi gue gak ada salah apa apa kok kena benned sih apa salah saya orang orang rekam video porno gak di benned,3,0,605030,2021-03-28 01:14:09,,,most_relevant,omegle.tv
gp:AOqpTOF-ZDxW5-diW4vuagiRyRzCrphDDf-DxEAqwEPiXE5YRay42rooYtQShdlH9pkelzfB63JcQRVOwjcs-w,Nia Agustina Ramadhany,https://play-lh.googleusercontent.com/a/AATXAJyG2u8ugiFKK1WzIXF8Ge1u1_7_iMug_iDax9GY=mo,Sebenarnya aplikasi ini bagus dan saya baru pertama kali juga pake ome tv. Tapi tolong buat adminnya orang2 yang ga punya etika baik di blacklist aja.. meresahkan sekali..,3,1,,2021-02-16 07:23:31,,,most_relevant,omegle.tv
gp:AOqpTOHzL5Cblxqqj10Hj-m58M-OZYF95F1p9RFUW6m0ZQySgdasVghRhph28iJ0c7cXMB439ZJ8uhoXxJ_gZQ,Riska Fadillah,https://play-lh.googleusercontent.com/a/AATXAJx5F5UvIln3L_uNKUmykhMeFbTOcFH7I9N13mpm=mo,Ini aplikasi nya bagus tapi ada yg gak pantas untuk di lihat maaf aku kasih bintang 🌟 🌟🌟,3,0,,2021-05-22 12:34:37,,,most_relevant,omegle.tv
gp:AOqpTOGC7UnXLJELFt1H4B_SWxaBrVoG7UyrFaYYpB8SvPJ3e4smAoG0HKdcxZ1R1NPwiYrsUu3dhuBMdFjU1w,Icha 022,https://play-lh.googleusercontent.com/a-/AOh14GgvrSVsGUX27FDji5GCWSM-ZKfQZUd3XtpTI6Rcow,Maaf ya ..aku kasih bintang 3 dlu..nanti klo emng cocok..aku kash bintang lima...,3,0,,2021-03-20 06:38:06,,,most_relevant,omegle.tv
gp:AOqpTOEOwzMOA-BEizss7kTMEO6-igofte8Msi1ZTFsOQa94Atml6WRvFenIGyXCjEoTHSuY69Zyqvw6kGGVxg,mikimilk000,https://play-lh.googleusercontent.com/a-/AOh14Gj1fHDf4yzg4BGrQRt8lCQa-eGzf8AeBUptcoUhqA,Gua cuma mau bilang knp saya di banned karena hal pornografi padahal saya tidak melakukannya tolong perbaiki 🔥,3,0,,2021-03-06 16:24:45,,,most_relevant,omegle.tv
gp:AOqpTOFtIkfxZwaZLX8y_zlxxltcEgVt3xhlx_QZL582MHS0XP-AgdvZrls9QrUHa4RI6jomicEbfdO3sX9TPg,Rahmah putri,https://play-lh.googleusercontent.com/a-/AOh14Gj-jfxnCnoaJtpX-6Gbar0wnGn0HTme9KOVaYxU,"Saya sering sekali melihat orang orang di aplikasi ini hanya pamer batang , tolong dong di blokir saja orang yang seperti itu 🙏 merusak moral anak kecil",3,3,605030,2021-02-09 01:53:30,,,most_relevant,omegle.tv
gp:AOqpTOFEEwmmN2UzVedNJro4TUWdLIODxs6lmGN4F9N5vBPZLzhFZajUkNTpu9yzkJ7uQikveKqckmhzfyUnuQ,Mahbuby Starr,https://play-lh.googleusercontent.com/a-/AOh14Gi8GiSCxqSRkJB65iE4PW1p0axXsyC22XTjlH1C,Tolong ome tv nya di kasih fitur buat nyari orang agar bisa ketemu sama orang itu soalnya gue pernah di ajarin mengerjakan pekerjaan sekolah sama orang nya . Pleaase ya 🙏,3,0,,2021-02-20 17:05:33,,,most_relevant,omegle.tv
gp:AOqpTOEdAS7j_ae_M2W9OzbNGjYCoDTq2wb5cfD6OHhBQziF7HLOEjw7VSlcVOjz-w0VNSkUrVyehgwUqa03XA,ilham si dewa mabok,https://play-lh.googleusercontent.com/a-/AOh14GhgfvzVdA38YXskYf3eXZ5V6svFuKlfCvqcb44,Maaf banget ya aslinya aku suka sama apk nya cuma tiba tiba di keluarin kalo mauk maen apk nya harus bayar 80 ribu,3,0,,2021-03-11 20:28:11,,,most_relevant,omegle.tv
gp:AOqpTOE6thb0Kg0Qi8hC2xj5_vjyPw-xCnx7qbl4ObNC74hhq5vmLaBv5SJ3FGSBrQP5Ij3wOtSrKlyLK-75Lw,Fatmawati Wati,https://play-lh.googleusercontent.com/a/AATXAJyWcVKeCKPWE-ZSVhk_5EMvz3mEQBs1JHDdZExM=mo,Aplikasi nya bagus gak mau cobk dulu nanti kalo bagus aku tambahin lagi bintang nya 😁,3,0,,2021-05-23 20:42:16,,,most_relevant,omegle.tv
gp:AOqpTOE2CCjis84ectNA5_kT_6R8YTrIxtkeK7Q_xKGYDNXdGdQa6KUxxTGb3D6MoUL625AEykRoVswh2_pykQ,Wan Izah,https://play-lh.googleusercontent.com/a/AATXAJxEQXtSBciunelW7neQ2kfQ2LTklBqoLwlALXcO=mo,Aplikasi nya bagus cuman yang make aplikasi nya itu banyak yang nggak baik lah poko nya,3,0,605030,2021-04-04 09:34:08,,,most_relevant,omegle.tv
gp:AOqpTOGQv0nxGjD80HupuKOOTw3XBQuknFBYAs5hAbSOuDKXWahrocVyf0cXxpFtYwILViLvhVGMAzpU0A8ImA,Andri Anto,https://play-lh.googleusercontent.com/a-/AOh14Ghb-9wkiVbW5G6pcINzIU5AzMF0UxIbeaEkAuuO1g,"Aplikasi ini mudah diretas, sebab saya tidak berbuat aneh, tapi dilaporkan tidak sopan dan cabul,, mohon keamanannya ditingkatkan lagi",3,0,,2021-02-07 14:21:47,,,most_relevant,omegle.tv
gp:AOqpTOHsXXsqHW1lBWfk_0N6ceOvI4S0xHwCltI6OwgKTsyW7d3jSRlMSmV5YMYJgxRtnoEhR02TqFS81GRr8g,Coc Coc,https://play-lh.googleusercontent.com/a/AATXAJw8XYxTjnLeYtFO_9rRWMThAzn9GBRbFHy3b1_Q=mo,"Ni gua kasih saran biar orang tertarik sama aplikasi ome: harus nya ada jenis gender laki-laki dan perempuan, nanti yang laki2 sering di ketemuin sama yang perempuan...dan juga sebalik nya. Soal nya...masa gua yang laki2 ketemu nya selalu yang laki2 juga, emang nya gua homo, ome payah😂😂😂",3,0,6.3.6,2018-10-12 05:05:06,,,most_relevant,omegle.tv
gp:AOqpTOF_7h_HCNuKFBYM7Hfn1DjQ8c-3QfaEEnzEIvB9cGfGXeeL5Se0V0GsBfQoU-Os8d1LN2D8pHFHX6eMDw,syina ryanti,https://play-lh.googleusercontent.com/a-/AOh14GiAPFcQdylpIkmR7Rvf5jcACUqCv0nm6WULx5dI7hA,Bagus sih tapi ada yang jorok jorok aku kasih bintang 3 aja jangan ada yang jorok maaf,3,0,605030,2021-03-02 13:12:00,,,most_relevant,omegle.tv
gp:AOqpTOHAeISwLOjf283Re0mUpxEo8pWvWOjw6z5koCavmN56E1k6MINgR2oeQvsaulS33SCJvxY1KucKc0hYSw,Emmanuel Macron,https://play-lh.googleusercontent.com/a-/AOh14Gi87ZFF2rufCSuD9kWq1gfNOmypPo73Shx9ZVPw8A,Sudah bagus tapi memohon untuk pihak ome tv kan sudah ada server luar negara tapi mengapa saat pakai server luar negara malah bertemu dengan server luar negara tolong di sesuaikan dengan yang kita mau nanti kalau bagus saya kasih bintang tambahan,3,87,605030,2021-02-11 12:13:36,,,most_relevant,omegle.tv
gp:AOqpTOFlZpTF-Sl9MtdL49kzVXo5YbQn3fIqu1WDxG-89W9ZOLQz0IcSUXQcmH1ECN2i9IwsC2i0oZ3Qypx4_g,fajar muhajir,https://play-lh.googleusercontent.com/a-/AOh14GhpWCInLrRzXxsrADKKFqdnERxp16cEnEFKmOyV,"Aku suka aplikasi ini, aku kasih bintang 3 karena setiap hari saya bisa melihat wajah baru di ome tv, tapi tidak tau kenapa saya melihat beberapa orang lain yang menunjukan kemaluannya, ehh...... Beberapa menit saya terkena banned dari ome tv, saya salah apa??? Dan kenapa yang menunjukan kemaluannya tersebut tidak di banned?? Kenapa harus saya??? Saya tidak tahu salah saya, tolong di perbaiki ya.. Pihak ome tv, saya beri bintang 3 dulu karena app ini belum sepenuhnya sempurna, sekian trmaksih",3,0,,2020-03-19 21:13:54,,,most_relevant,omegle.tv
gp:AOqpTOGKnN4wA9DAF0LZOCGUGy_n39V16bpmVF_l9geZfwtpuU2yfUme_Kw7xZ6FdbVygoyHrBu0ajCVNPEYzw,Mariatul Qibtiyah,https://play-lh.googleusercontent.com/a-/AOh14GjveqnoSK7Z6Ycw3aIcRY5kJn6aK9qz5m_8iHYC8hg,"Aplikasi ini sudah cukup bagus penggunaannya, simpel. namun sayang alangkah baiknya jika umur pengguna nya dibatasi, karena kebanyakan sekarang yg main aplikasi ini anak dibawah umur (underage) padahal dalam plikasi ini banyak sekali orang2 yg menyalahgunakan untuk ******** nya. terima kasih. semoga bisa dipertimbangkan pihak developer.",3,10,6.3.6,2019-07-03 10:25:54,,,most_relevant,omegle.tv
gp:AOqpTOE_7JHymicM5vCvuJj7pAZ16g-bP97v-MaThddj4nJyuBPCWmG3EYcTMWrqMOF7uTPdZM1SyI-pNM007g,Pengguna Google,https://play-lh.googleusercontent.com/EGemoI2NTXmTsBVtJqk8jxF9rh8ApRWfsIMQSt2uE4OcpQqbFu7f7NbTK05lx80nuSijCz7sc3a277R67g,"Tadi gue ketemu bocah yang lagi main gitar. Dia tanya gue mau req lagu apa. Setelah mainin 3 lagu tuh bocah gue tanyain umur, eh malah gue di next. Sok ganteng banget lo.. asli nih ya sebenernya gitar lo tuh fales suara lo juga, gak pas lagi sama nadanya.. jelek ancurlah pokoknya. Nyesel gue sok baik sama lo mau dengerin sampe 3 lagu",3,0,6.3.6,2018-11-01 08:40:32,,,most_relevant,omegle.tv
gp:AOqpTOGsV7oJcUcz9eJ3WowWtYIHYb92KsEMDSWArGuhz4aiMkek4G4VggxTss5i71SUIMx4T4qIsjkgp7FX6Q,Zulfiky Vizx,https://play-lh.googleusercontent.com/a/AATXAJzkUj65PSTh5y8mvpQj0xT6rcvPAl9AKG0SOJmN=mo,Woooooiiiiiiiiiiiiiiiiiiiiiiiiiiiiiiiiiiiiiiiiiiiiiiiiiiiiiiiiiiiiiiiiii tolong jelasin kenapa ome tv aku masuk ke server india padahl udh aku ganti bendera nya ke Indonesia tapi masih tetep yg muncul orang india semua gk ada Indonesia yg sama komen yg tau coba jelaskan lahhh,3,5,605030,2021-01-18 22:35:22,,,most_relevant,omegle.tv
gp:AOqpTOGom0RTlVBYrjCkH1U0johb1f6lKCNNB0DfBuhBiTXrmu20c5Oy2kPJUXyMbmwobzE8wm-P4Wh9itP4Og,Marselinus Christian,https://play-lh.googleusercontent.com/a-/AOh14GjRDZKgJAV5ZMtk1iY9r_rSuNks1PHHuis2Hui6iw,"Karena selama saya pake apk ini saya gak dapet temen sm sekali apalagi pacar,mohon yg main ome tv jgn skip-skip mulu",3,0,605030,2021-03-05 23:06:06,,,most_relevant,omegle.tv
